{
  "schema_version": "plant-knowledge-layer-evidence-v1",
  "dataset_version": "pkl-v1-publication-minimum-expansion-20260824-draft",
  "registry_source": {
    "registry_path": "data/plant_component_registry_v1/registry.batch1.json",
    "registry_version": "v1-publication-minimum-expansion-20260824-draft",
    "source_manifest_path": "data/plant_component_registry_v1/source_manifest.csv"
  },
  "records": [
    {
      "evidence_object_id": "PKL1-EV-PRO-35S-835",
      "component_id": "PCLV1-PRO-35S-835",
      "display_name": "CaMV 35S promoter evidence context",
      "component_type": "promoter",
      "registry_reference": {
        "component_id": "PCLV1-PRO-35S-835",
        "accession": "AF485783",
        "accession_version": "AF485783.1",
        "sequence_length": 835,
        "sequence_sha256": "4f5069bdd68260bb7a243ec7f8b628e13d52f58242c6f7acf53e3cc55a8673e2",
        "source_record": "data/plant_component_registry_v1/source_records/AF485783.1.gb",
        "source_record_sha256": "7301abcf3146e14cd4826a8c8b7f44d65a0b03b0f642695f6d8277ea56d733d7"
      },
      "literature_references": [
        {"reference_id": "LIT-PRO-35S-UNKNOWN", "status": "UNKNOWN", "citation": null, "provenance_note": "No reviewed literature citation is attached to this object; the Registry primary reference is a GenBank record.", "source_database": "NCBI GenBank", "doi": null, "pmid": null}
      ],
      "biological_context": {
        "source_organism": "Cauliflower mosaic virus",
        "target_host_species": ["Arabidopsis thaliana", "Nicotiana benthamiana", "Solanum lycopersicum", "Glycine max"],
        "host_group": ["dicot"],
        "registry_component_role": "constitutive promoter",
        "registry_evidence_level": "E1",
        "context_status": "RECORDED_FROM_REGISTRY",
        "tissue_context": {"status": "UNKNOWN", "reason": "No tissue-specific context is recorded in this object."},
        "function_claim_status": "UNKNOWN"
      },
      "evidence_claims": [
        {"claim_id": "PKL1-CLM-35S-IDENTITY", "claim_type": "IDENTITY", "statement": "The Registry identifies this object as CaMV 35S promoter component PCLV1-PRO-35S-835.", "fact_status": "RECORDED_FROM_REGISTRY", "provenance": "registry.batch1.json:PCLV1-PRO-35S-835", "review_status": "PENDING_HUMAN_REVIEW", "unknown_reason": "Registry linkage is recorded, but this knowledge-layer claim remains pending human review.", "evidence_level": "E1"},
        {"claim_id": "PKL1-CLM-35S-BOUNDARY", "claim_type": "BOUNDARY", "statement": "The Registry records the source feature as AF485783.1 regulatory CaMV 35S at 4974..5808 on the plus strand.", "fact_status": "RECORDED_FROM_REGISTRY", "provenance": "registry.batch1.json:PCLV1-PRO-35S-835.feature_boundary_method", "review_status": "PENDING_HUMAN_REVIEW", "unknown_reason": "Boundary provenance is preserved for review; no independent re-interpretation is made here.", "evidence_level": "E1"},
        {"claim_id": "PKL1-CLM-35S-FUNCTION", "claim_type": "FUNCTION", "statement": "Functional performance, strength, and host-specific expression effects are not established by this object.", "fact_status": "UNKNOWN", "provenance": "knowledge-layer curation boundary", "review_status": "PENDING_HUMAN_REVIEW", "unknown_reason": "No reviewed literature evidence was attached for a performance or expression claim.", "evidence_level": "UNKNOWN"}
      ],
      "engineering_context_notes": [
        "The Plant Component Registry remains authoritative for sequence, identity, accession, and hash.",
        "This object stores a reference to the Registry sequence and does not duplicate sequence data.",
        "Use in a construct remains subject to the existing Registry and formal workflow contracts."
      ],
      "limitations": [
        "Literature citation is unknown and requires human curation.",
        "No expression success, promoter strength, optimization, or wet-lab readiness conclusion is provided.",
        "Public-record redistribution and rights status remains the Registry value PUBLIC_NCBI_RECORD_NEEDS_REVIEW."
      ],
      "review": {"record_status": "DRAFT", "human_review_status": "PENDING_HUMAN_REVIEW", "reviewer": null, "reviewed_at_utc": null, "review_notes": "Initial evidence context only; human source and claim review is required."}
    },
    {
      "evidence_object_id": "PKL1-EV-PRO-UBQ10",
      "component_id": "PCLV1-PRO-UBQ10",
      "display_name": "AtUBQ10 promoter evidence context",
      "component_type": "promoter",
      "registry_reference": {
        "component_id": "PCLV1-PRO-UBQ10",
        "accession": "HQ693235",
        "accession_version": "HQ693235.1",
        "sequence_length": 636,
        "sequence_sha256": "b24922506b7b3660d7ce5e58986994888077a013da1c123a0139a2e45419c5a4",
        "source_record": "data/plant_component_registry_v1/source_records/HQ693235.1.gb",
        "source_record_sha256": "5e20eb0c773738349f1a74b661d7282be2aeb057196e2953525f6ba885de0e84"
      },
      "literature_references": [
        {"reference_id": "LIT-PRO-UBQ10-UNKNOWN", "status": "PENDING_HUMAN_REVIEW", "citation": null, "provenance_note": "The Registry notes a Hashimoto and Kudla direct submission (2010); a full literature citation has not been independently curated here.", "source_database": "NCBI GenBank", "doi": null, "pmid": null}
      ],
      "biological_context": {
        "source_organism": "Arabidopsis thaliana",
        "target_host_species": ["Arabidopsis thaliana"],
        "host_group": ["dicot"],
        "registry_component_role": "ubiquitin promoter",
        "registry_evidence_level": "E1",
        "context_status": "RECORDED_FROM_REGISTRY",
        "tissue_context": {"status": "UNKNOWN", "reason": "No tissue-specific context is recorded in this object."},
        "function_claim_status": "UNKNOWN"
      },
      "evidence_claims": [
        {"claim_id": "PKL1-CLM-UBQ10-IDENTITY", "claim_type": "IDENTITY", "statement": "The Registry identifies this object as AtUBQ10 promoter component PCLV1-PRO-UBQ10.", "fact_status": "RECORDED_FROM_REGISTRY", "provenance": "registry.batch1.json:PCLV1-PRO-UBQ10", "review_status": "PENDING_HUMAN_REVIEW", "unknown_reason": "Registry linkage is recorded, but this knowledge-layer claim remains pending human review.", "evidence_level": "E1"},
        {"claim_id": "PKL1-CLM-UBQ10-BOUNDARY", "claim_type": "BOUNDARY", "statement": "The Registry records the source feature as HQ693235.1 regulatory UBQ10 promoter at 1..636 on the plus strand.", "fact_status": "RECORDED_FROM_REGISTRY", "provenance": "registry.batch1.json:PCLV1-PRO-UBQ10.feature_boundary_method", "review_status": "PENDING_HUMAN_REVIEW", "unknown_reason": "Boundary provenance is preserved for review; no independent re-interpretation is made here.", "evidence_level": "E1"},
        {"claim_id": "PKL1-CLM-UBQ10-FUNCTION", "claim_type": "FUNCTION", "statement": "Functional performance and host-specific expression effects are not established by this object.", "fact_status": "UNKNOWN", "provenance": "knowledge-layer curation boundary", "review_status": "PENDING_HUMAN_REVIEW", "unknown_reason": "The initial object contains no independently reviewed functional literature claim.", "evidence_level": "UNKNOWN"}
      ],
      "engineering_context_notes": [
        "The Plant Component Registry remains authoritative for sequence, identity, accession, and hash.",
        "This object stores a reference to the Registry sequence and does not duplicate sequence data.",
        "The 636 bp fragment is retained as Registry metadata, not as a second component record."
      ],
      "limitations": [
        "The full literature citation for the direct submission is pending human review.",
        "No promoter strength, expression success, optimization, or wet-lab readiness conclusion is provided.",
        "Public-record rights caveat remains the Registry value PUBLIC_NCBI_RECORD_RIGHTS_CAVEAT_RECORDED."
      ],
      "review": {"record_status": "DRAFT", "human_review_status": "PENDING_HUMAN_REVIEW", "reviewer": null, "reviewed_at_utc": null, "review_notes": "Initial evidence context only; human source and claim review is required."}
    },
    {
      "evidence_object_id": "PKL1-EV-VEC-PBIN19",
      "component_id": "PCLV1-VEC-PBIN19",
      "display_name": "pBIN19 vector evidence context",
      "component_type": "vector_backbone",
      "registry_reference": {
        "component_id": "PCLV1-VEC-PBIN19",
        "accession": "U09365",
        "accession_version": "U09365.1",
        "sequence_length": 11777,
        "sequence_sha256": "9e8a6e62caaff3c4204ffd3a250e56e2486c7fb593304afa7403f06bd2a755ff",
        "source_record": "data/plant_component_registry_v1/source_records/U09365.1.gb",
        "source_record_sha256": "d0b13b3534d70e35c028f0bf3f0f22b5d3d638a5f0022e4b249a90201057e7ca"
      },
      "literature_references": [
        {"reference_id": "PMID-7888628", "status": "RECORDED", "citation": "Frisch et al., Plant Molecular Biology 27:405-409 (1995), PMID 7888628", "provenance_note": "Citation string is preserved from the Registry primary_reference field; independent bibliographic review remains pending.", "source_database": "PubMed", "doi": null, "pmid": "7888628"}
      ],
      "biological_context": {
        "source_organism": "Binary vector Bin19",
        "target_host_species": ["Arabidopsis thaliana", "Nicotiana benthamiana", "Oryza sativa", "Zea mays", "Solanum lycopersicum", "Glycine max"],
        "host_group": ["dicot", "monocot"],
        "registry_component_role": "complete binary vector source for manual T-DNA replacement review",
        "registry_evidence_level": "E1",
        "context_status": "RECORDED_FROM_REGISTRY",
        "tissue_context": {"status": "UNKNOWN", "reason": "No tissue-specific context is recorded in this object."},